<?xml version="1.0" encoding="UTF-8"?>
<imto:IMTOReturn xmlns:imto="urn:cbn:imto:reporting:v1"
                 xmlns:xsi="http://www.w3.org/2001/XMLSchema-instance"
                 xsi:schemaLocation="urn:cbn:imto:reporting:v1 IMTO_Return_Schema_v1.0.xsd"
                 schemaVersion="1.0">

  <imto:Header>
    <imto:IMTOLicenceNo>CBN/IMTO/2019/045</imto:IMTOLicenceNo>
    <imto:IMTOName>Sample Remit International Limited</imto:IMTOName>
    <imto:ReturnType>VOL</imto:ReturnType>
    <imto:IMTOType>Foreign</imto:IMTOType>
    <imto:ReportFrequency>Monthly</imto:ReportFrequency>
    <imto:ReportingPeriodStart>2026-03-01</imto:ReportingPeriodStart>
    <imto:ReportingPeriodEnd>2026-03-31</imto:ReportingPeriodEnd>
    <imto:SubmissionDateTime>2026-04-05T14:00:00Z</imto:SubmissionDateTime>
    <imto:ContactPerson>Amaka Obi</imto:ContactPerson>
    <imto:ContactEmail>compliance@sampleremit.com</imto:ContactEmail>
  </imto:Header>

  <imto:VolumeSummary>
    <imto:TotalTransactions>42850</imto:TotalTransactions>
    <imto:TotalValueUSD>28500000.00</imto:TotalValueUSD>
    <imto:TotalNairaDisbursed>45315000000.00</imto:TotalNairaDisbursed>
    <imto:AverageTransactionSize>665.11</imto:AverageTransactionSize>
    <imto:CashPayouts>3428</imto:CashPayouts>
    <imto:AccountCreditPayouts>39422</imto:AccountCreditPayouts>
    <imto:WeightedAvgFXRate>1590.00</imto:WeightedAvgFXRate>
    <imto:PendingSettlement>125</imto:PendingSettlement>
    <imto:FailedTransactions>38</imto:FailedTransactions>
  </imto:VolumeSummary>

  <imto:CorridorAnalysis>
    <imto:Corridor>
      <imto:SourceCountry>US</imto:SourceCountry>
      <imto:Transactions>15200</imto:Transactions>
      <imto:VolumeUSD>12350000.00</imto:VolumeUSD>
      <imto:PctOfTotal>43.33</imto:PctOfTotal>
      <imto:AvgTxnSize>812.50</imto:AvgTxnSize>
    </imto:Corridor>
    <imto:Corridor>
      <imto:SourceCountry>GB</imto:SourceCountry>
      <imto:Transactions>8900</imto:Transactions>
      <imto:VolumeUSD>6250000.00</imto:VolumeUSD>
      <imto:PctOfTotal>21.93</imto:PctOfTotal>
      <imto:AvgTxnSize>702.25</imto:AvgTxnSize>
    </imto:Corridor>
    <imto:Corridor>
      <imto:SourceCountry>CA</imto:SourceCountry>
      <imto:Transactions>4500</imto:Transactions>
      <imto:VolumeUSD>2850000.00</imto:VolumeUSD>
      <imto:PctOfTotal>10.00</imto:PctOfTotal>
      <imto:AvgTxnSize>633.33</imto:AvgTxnSize>
    </imto:Corridor>
    <imto:Corridor>
      <imto:SourceCountry>DE</imto:SourceCountry>
      <imto:Transactions>3200</imto:Transactions>
      <imto:VolumeUSD>1900000.00</imto:VolumeUSD>
      <imto:PctOfTotal>6.67</imto:PctOfTotal>
      <imto:AvgTxnSize>593.75</imto:AvgTxnSize>
    </imto:Corridor>
    <imto:Corridor>
      <imto:SourceCountry>SA</imto:SourceCountry>
      <imto:Transactions>2800</imto:Transactions>
      <imto:VolumeUSD>1450000.00</imto:VolumeUSD>
      <imto:PctOfTotal>5.09</imto:PctOfTotal>
      <imto:AvgTxnSize>517.86</imto:AvgTxnSize>
    </imto:Corridor>
    <imto:TotalCorridorVolume>28500000.00</imto:TotalCorridorVolume>
  </imto:CorridorAnalysis>

  <imto:AgentBankOps>
    <imto:AgentBank>
      <imto:BankName>First Bank of Nigeria PLC</imto:BankName>
      <imto:BankCode>011</imto:BankCode>
      <imto:TransactionsProcessed>18500</imto:TransactionsProcessed>
      <imto:ValuePaidOut>19500000000.00</imto:ValuePaidOut>
      <imto:AgencyAgreementExpiry>2027-06-30</imto:AgencyAgreementExpiry>
    </imto:AgentBank>
    <imto:AgentBank>
      <imto:BankName>Zenith Bank PLC</imto:BankName>
      <imto:BankCode>057</imto:BankCode>
      <imto:TransactionsProcessed>14200</imto:TransactionsProcessed>
      <imto:ValuePaidOut>15200000000.00</imto:ValuePaidOut>
      <imto:AgencyAgreementExpiry>2027-03-31</imto:AgencyAgreementExpiry>
    </imto:AgentBank>
    <imto:AgentBank>
      <imto:BankName>Access Bank PLC</imto:BankName>
      <imto:BankCode>044</imto:BankCode>
      <imto:TransactionsProcessed>10150</imto:TransactionsProcessed>
      <imto:ValuePaidOut>10615000000.00</imto:ValuePaidOut>
      <imto:AgencyAgreementExpiry>2027-12-31</imto:AgencyAgreementExpiry>
    </imto:AgentBank>
    <imto:TotalSettlementAmount>45315000000.00</imto:TotalSettlementAmount>
    <imto:AvgSettlementCycleHours>4</imto:AvgSettlementCycleHours>
    <imto:CustomerFundsSegregated>true</imto:CustomerFundsSegregated>
  </imto:AgentBankOps>

  <imto:FXSettlement>
    <imto:RateReport>
      <imto:CurrencyPair>USD/NGN</imto:CurrencyPair>
      <imto:IMTORateApplied>1590.00</imto:IMTORateApplied>
      <imto:NFEMClosingRate>1588.50</imto:NFEMClosingRate>
      <imto:VariancePct>0.09</imto:VariancePct>
    </imto:RateReport>
    <imto:RateReport>
      <imto:CurrencyPair>GBP/NGN</imto:CurrencyPair>
      <imto:IMTORateApplied>2012.00</imto:IMTORateApplied>
      <imto:NFEMClosingRate>2010.25</imto:NFEMClosingRate>
      <imto:VariancePct>0.09</imto:VariancePct>
    </imto:RateReport>
    <imto:RateReport>
      <imto:CurrencyPair>EUR/NGN</imto:CurrencyPair>
      <imto:IMTORateApplied>1725.00</imto:IMTORateApplied>
      <imto:NFEMClosingRate>1723.80</imto:NFEMClosingRate>
      <imto:VariancePct>0.07</imto:VariancePct>
    </imto:RateReport>
    <imto:TotalFXReceived>28500000.00</imto:TotalFXReceived>
    <imto:TotalNairaDisbursed>45315000000.00</imto:TotalNairaDisbursed>
    <imto:NostroBalance>2150000.00</imto:NostroBalance>
    <imto:NoDomesticFXPurchase>true</imto:NoDomesticFXPurchase>
  </imto:FXSettlement>

  <imto:AMLCompliance>
    <imto:STRsFiled>3</imto:STRsFiled>
    <imto:CTRsFiled>285</imto:CTRsFiled>
    <imto:OriginatingCountrySTRs>2</imto:OriginatingCountrySTRs>
    <imto:TMSAlerts>425</imto:TMSAlerts>
    <imto:SplitTransactionAlerts>18</imto:SplitTransactionAlerts>
    <imto:SanctionsHits>5</imto:SanctionsHits>
    <imto:BVNVerificationRate>97.50</imto:BVNVerificationRate>
    <imto:StaffTrainedPct>100.00</imto:StaffTrainedPct>
  </imto:AMLCompliance>

  <imto:Signature>
    <imto:PreparedBy>
      <imto:Name>Amaka Obi</imto:Name>
      <imto:Designation>Head of Compliance &amp; Regulatory Affairs</imto:Designation>
      <imto:Date>2026-04-03</imto:Date>
    </imto:PreparedBy>
    <imto:MDSignOff>
      <imto:Name>David Okonkwo</imto:Name>
      <imto:Designation>Managing Director / CEO</imto:Designation>
      <imto:Date>2026-04-05</imto:Date>
    </imto:MDSignOff>
    <imto:CertificationStatement>I/We certify that this return is filed in compliance with the CBN Guidelines for International Money Transfer Services in Nigeria (January 2024), BOFIA 2020, and all applicable AML/CFT/CPF regulations. The information provided is true, accurate, and complete.</imto:CertificationStatement>
  </imto:Signature>

</imto:IMTOReturn>
